


---

** [feature-requests:#197] Device 0 (VID=2357 and PID=031a) is UNKNOWN in libmtp v1.1.12.**

**Status:** open
**Group:** Future
**Created:** Fri Dec 02, 2016 11:55 PM UTC by Mikhail Morfikov
**Last Updated:** Fri Dec 02, 2016 11:55 PM UTC
**Owner:** nobody


My PC:

~~~
$ cat /etc/debian_version
stretch/sid

$ uname -rv
4.8.0-1-amd64 #1 SMP Debian 4.8.7-1 (2016-11-13)

$ gcc --version | head -n 1
gcc (Debian 6.2.1-5) 6.2.1 20161124
~~~

I have a smartphone model Neffos C5 MAX from TP-LINK:

~~~
$ lsusb -vvv -d 2357:031a

Bus 002 Device 036: ID 2357:031a
Device Descriptor:
  bLength                18
  bDescriptorType         1
  bcdUSB               2.00
  bDeviceClass            0 (Defined at Interface level)
  bDeviceSubClass         0
  bDeviceProtocol         0
  bMaxPacketSize0        64
  idVendor           0x2357
  idProduct          0x031a
  bcdDevice           ff.ff
  iManufacturer           2 TP-LINK
  iProduct                3 Neffos
  iSerial                 4 8HCMMZFI89ROBI9H
  bNumConfigurations      1
  Configuration Descriptor:
    bLength                 9
    bDescriptorType         2
    wTotalLength           39
    bNumInterfaces          1
    bConfigurationValue     1
    iConfiguration          0
    bmAttributes         0xc0
      Self Powered
    MaxPower              500mA
    Interface Descriptor:
      bLength                 9
      bDescriptorType         4
      bInterfaceNumber        0
      bAlternateSetting       0
      bNumEndpoints           3
      bInterfaceClass       255 Vendor Specific Class
      bInterfaceSubClass    255 Vendor Specific Subclass
      bInterfaceProtocol      0
      iInterface             17 MTP
      Endpoint Descriptor:
        bLength                 7
        bDescriptorType         5
        bEndpointAddress     0x81  EP 1 IN
        bmAttributes            2
          Transfer Type            Bulk
          Synch Type               None
          Usage Type               Data
        wMaxPacketSize     0x0200  1x 512 bytes
        bInterval               0
      Endpoint Descriptor:
        bLength                 7
        bDescriptorType         5
        bEndpointAddress     0x01  EP 1 OUT
        bmAttributes            2
          Transfer Type            Bulk
          Synch Type               None
          Usage Type               Data
        wMaxPacketSize     0x0200  1x 512 bytes
        bInterval               0
      Endpoint Descriptor:
        bLength                 7
        bDescriptorType         5
        bEndpointAddress     0x82  EP 2 IN
        bmAttributes            3
          Transfer Type            Interrupt
          Synch Type               None
          Usage Type               Data
        wMaxPacketSize     0x001c  1x 28 bytes
        bInterval               6
Device Qualifier (for other device speed):
  bLength                10
  bDescriptorType         6
  bcdUSB               2.00
  bDeviceClass            0 (Defined at Interface level)
  bDeviceSubClass         0
  bDeviceProtocol         0
  bMaxPacketSize0        64
  bNumConfigurations      1
Device Status:     0x0001
  Self Powered
~~~

~~~
$ mtp-detect
libmtp version: 1.1.12

Listing raw device(s)
Device 0 (VID=2357 and PID=031a) is UNKNOWN in libmtp v1.1.12.
Please report this VID/PID and the device model to the libmtp development team
   Found 1 device(s):
   2357:031a @ bus 2, dev 36
Attempting to connect device(s)
Android device detected, assigning default bug flags
USB low-level info:
   bcdUSB: 512
   bDeviceClass: 0
   bDeviceSubClass: 0
   bDeviceProtocol: 0
   idVendor: 2357
   idProduct: 031a
   IN endpoint maxpacket: 512 bytes
   OUT endpoint maxpacket: 512 bytes
   Raw device info:
      Bus location: 2
      Device number: 36
      Device entry info:
         Vendor: (null)
         Vendor id: 0x2357
         Product: (null)
         Vendor id: 0x031a
         Device flags: 0x18008106
Configuration 0, interface 0, altsetting 0:
   Interface description contains the string "MTP"
   Device recognized as MTP, no further probing.
Device info:
   Manufacturer: TP-LINK
   Model: Neffos C5 Max
   Device version: 1.0
   Serial number: 8HCMMZFI89ROBI9H
   Vendor extension ID: 0x00000006
   Vendor extension description: microsoft.com: 1.0; android.com: 1.0;
   Detected object size: 64 bits
   Extensions:
        microsoft.com: 1.0
        android.com: 1.0
Supported operations:
   1001: Unknown(1001)
   1002: Unknown(1002)
   1003: Unknown(1003)
   1004: Unknown(1004)
   1005: Unknown(1005)
   1006: Unknown(1006)
   1007: Unknown(1007)
   1008: Unknown(1008)
   1009: Unknown(1009)
   100a: Unknown(100a)
   100b: Unknown(100b)
   100c: Unknown(100c)
   100d: Unknown(100d)
   1014: Unknown(1014)
   1015: Unknown(1015)
   1016: Unknown(1016)
   1017: Unknown(1017)
   101b: Unknown(101b)
   9801: Unknown(9801)
   9802: Unknown(9802)
   9803: Unknown(9803)
   9804: Unknown(9804)
   9805: Unknown(9805)
   9810: Unknown(9810)
   9811: Unknown(9811)
   95c1: Unknown(95c1)
   95c2: Unknown(95c2)
   95c3: Unknown(95c3)
   95c4: Unknown(95c4)
   95c5: Unknown(95c5)
Events supported:
   0x4002
   0x4003
   0x4004
   0x4005
   0x4006
   0x4007
   0x400c
Device Properties Supported:
   0xd401: Synchronization Partner
   0xd402: Friendly Device Name
   0x5003: Image Size
   0x5001: Battery Level
Playable File (Object) Types and Object Properties Supported:
   3000: Undefined Type
      dc01: Storage ID UINT32 data type ANY 32BIT VALUE form READ ONLY
      dc02: Object Format UINT16 data type ANY 16BIT VALUE form READ ONLY
      dc03: Protection Status UINT16 data type ANY 16BIT VALUE form READ ONLY
      dc04: Object Size UINT64 data type READ ONLY
      dc07: Object File Name STRING data type GET/SET
      dc09: Date Modified STRING data type DATETIME FORM READ ONLY
      dc0b: Parent Object UINT32 data type ANY 32BIT VALUE form READ ONLY
      dc41: Persistant Unique Object Identifier UINT128 data type READ ONLY
      dc44: Name STRING data type READ ONLY
      dce0: Display Name STRING data type READ ONLY
      dc4e: Date Added STRING data type DATETIME FORM READ ONLY
   3001: Association/Directory
      dc01: Storage ID UINT32 data type ANY 32BIT VALUE form READ ONLY
      dc02: Object Format UINT16 data type ANY 16BIT VALUE form READ ONLY
      dc03: Protection Status UINT16 data type ANY 16BIT VALUE form READ ONLY
      dc04: Object Size UINT64 data type READ ONLY
      dc07: Object File Name STRING data type GET/SET
      dc09: Date Modified STRING data type DATETIME FORM READ ONLY
      dc0b: Parent Object UINT32 data type ANY 32BIT VALUE form READ ONLY
      dc41: Persistant Unique Object Identifier UINT128 data type READ ONLY
      dc44: Name STRING data type READ ONLY
      dce0: Display Name STRING data type READ ONLY
      dc4e: Date Added STRING data type DATETIME FORM READ ONLY
   3004: Text
      dc01: Storage ID UINT32 data type ANY 32BIT VALUE form READ ONLY
      dc02: Object Format UINT16 data type ANY 16BIT VALUE form READ ONLY
      dc03: Protection Status UINT16 data type ANY 16BIT VALUE form READ ONLY
      dc04: Object Size UINT64 data type READ ONLY
      dc07: Object File Name STRING data type GET/SET
      dc09: Date Modified STRING data type DATETIME FORM READ ONLY
      dc0b: Parent Object UINT32 data type ANY 32BIT VALUE form READ ONLY
      dc41: Persistant Unique Object Identifier UINT128 data type READ ONLY
      dc44: Name STRING data type READ ONLY
      dce0: Display Name STRING data type READ ONLY
      dc4e: Date Added STRING data type DATETIME FORM READ ONLY
   3005: HTML
      dc01: Storage ID UINT32 data type ANY 32BIT VALUE form READ ONLY
      dc02: Object Format UINT16 data type ANY 16BIT VALUE form READ ONLY
      dc03: Protection Status UINT16 data type ANY 16BIT VALUE form READ ONLY
      dc04: Object Size UINT64 data type READ ONLY
      dc07: Object File Name STRING data type GET/SET
      dc09: Date Modified STRING data type DATETIME FORM READ ONLY
      dc0b: Parent Object UINT32 data type ANY 32BIT VALUE form READ ONLY
      dc41: Persistant Unique Object Identifier UINT128 data type READ ONLY
      dc44: Name STRING data type READ ONLY
      dce0: Display Name STRING data type READ ONLY
      dc4e: Date Added STRING data type DATETIME FORM READ ONLY
   3008: MS Wave
      dc01: Storage ID UINT32 data type ANY 32BIT VALUE form READ ONLY
      dc02: Object Format UINT16 data type ANY 16BIT VALUE form READ ONLY
      dc03: Protection Status UINT16 data type ANY 16BIT VALUE form READ ONLY
      dc04: Object Size UINT64 data type READ ONLY
      dc07: Object File Name STRING data type GET/SET
      dc09: Date Modified STRING data type DATETIME FORM READ ONLY
      dc0b: Parent Object UINT32 data type ANY 32BIT VALUE form READ ONLY
      dc41: Persistant Unique Object Identifier UINT128 data type READ ONLY
      dc44: Name STRING data type READ ONLY
      dce0: Display Name STRING data type READ ONLY
      dc4e: Date Added STRING data type DATETIME FORM READ ONLY
      dc46: Artist STRING data type READ ONLY
      dc9a: Album Name STRING data type READ ONLY
      dc9b: Album Artist STRING data type READ ONLY
      dc8b: Track UINT16 data type ANY 16BIT VALUE form READ ONLY
      dc99: Original Release Date STRING data type DATETIME FORM READ ONLY
      dc89: Duration UINT32 data type ANY 32BIT VALUE form READ ONLY
      dc8c: Genre STRING data type READ ONLY
      dc96: Composer STRING data type READ ONLY
      de99: Audio WAVE Codec UINT32 data type ANY 32BIT VALUE form READ ONLY
      de92: Bit Rate Type UINT16 data type enumeration: 1, 2,  READ ONLY
      de9a: Audio Bit Rate UINT32 data type range: MIN 1, MAX 1536000, STEP 1 READ ONLY
      de94: Number Of Channels UINT16 data type enumeration: 1, 2, 3, 4, 5, 6, 7, 8, 9,  READ ONLY
      de93: Sample Rate UINT32 data type range: MIN 8000, MAX 48000, STEP 1 READ ONLY
   3009: MP3
      dc01: Storage ID UINT32 data type ANY 32BIT VALUE form READ ONLY
      dc02: Object Format UINT16 data type ANY 16BIT VALUE form READ ONLY
      dc03: Protection Status UINT16 data type ANY 16BIT VALUE form READ ONLY
      dc04: Object Size UINT64 data type READ ONLY
      dc07: Object File Name STRING data type GET/SET
      dc09: Date Modified STRING data type DATETIME FORM READ ONLY
      dc0b: Parent Object UINT32 data type ANY 32BIT VALUE form READ ONLY
      dc41: Persistant Unique Object Identifier UINT128 data type READ ONLY
      dc44: Name STRING data type READ ONLY
      dce0: Display Name STRING data type READ ONLY
      dc4e: Date Added STRING data type DATETIME FORM READ ONLY
      dc46: Artist STRING data type READ ONLY
      dc9a: Album Name STRING data type READ ONLY
      dc9b: Album Artist STRING data type READ ONLY
      dc8b: Track UINT16 data type ANY 16BIT VALUE form READ ONLY
      dc99: Original Release Date STRING data type DATETIME FORM READ ONLY
      dc89: Duration UINT32 data type ANY 32BIT VALUE form READ ONLY
      dc8c: Genre STRING data type READ ONLY
      dc96: Composer STRING data type READ ONLY
      de99: Audio WAVE Codec UINT32 data type ANY 32BIT VALUE form READ ONLY
      de92: Bit Rate Type UINT16 data type enumeration: 1, 2,  READ ONLY
      de9a: Audio Bit Rate UINT32 data type range: MIN 1, MAX 1536000, STEP 1 READ ONLY
      de94: Number Of Channels UINT16 data type enumeration: 1, 2, 3, 4, 5, 6, 7, 8, 9,  READ ONLY
      de93: Sample Rate UINT32 data type range: MIN 8000, MAX 48000, STEP 1 READ ONLY
   300b: MPEG
      dc01: Storage ID UINT32 data type ANY 32BIT VALUE form READ ONLY
      dc02: Object Format UINT16 data type ANY 16BIT VALUE form READ ONLY
      dc03: Protection Status UINT16 data type ANY 16BIT VALUE form READ ONLY
      dc04: Object Size UINT64 data type READ ONLY
      dc07: Object File Name STRING data type GET/SET
      dc09: Date Modified STRING data type DATETIME FORM READ ONLY
      dc0b: Parent Object UINT32 data type ANY 32BIT VALUE form READ ONLY
      dc41: Persistant Unique Object Identifier UINT128 data type READ ONLY
      dc44: Name STRING data type READ ONLY
      dce0: Display Name STRING data type READ ONLY
      dc4e: Date Added STRING data type DATETIME FORM READ ONLY
      dc46: Artist STRING data type READ ONLY
      dc9a: Album Name STRING data type READ ONLY
      dc89: Duration UINT32 data type ANY 32BIT VALUE form READ ONLY
      dc48: Description STRING data type READ ONLY
   3801: JPEG
      dc01: Storage ID UINT32 data type ANY 32BIT VALUE form READ ONLY
      dc02: Object Format UINT16 data type ANY 16BIT VALUE form READ ONLY
      dc03: Protection Status UINT16 data type ANY 16BIT VALUE form READ ONLY
      dc04: Object Size UINT64 data type READ ONLY
      dc07: Object File Name STRING data type GET/SET
      dc09: Date Modified STRING data type DATETIME FORM READ ONLY
      dc0b: Parent Object UINT32 data type ANY 32BIT VALUE form READ ONLY
      dc41: Persistant Unique Object Identifier UINT128 data type READ ONLY
      dc44: Name STRING data type READ ONLY
      dce0: Display Name STRING data type READ ONLY
      dc4e: Date Added STRING data type DATETIME FORM READ ONLY
      dc48: Description STRING data type READ ONLY
   3802: TIFF EP
      dc01: Storage ID UINT32 data type ANY 32BIT VALUE form READ ONLY
      dc02: Object Format UINT16 data type ANY 16BIT VALUE form READ ONLY
      dc03: Protection Status UINT16 data type ANY 16BIT VALUE form READ ONLY
      dc04: Object Size UINT64 data type READ ONLY
      dc07: Object File Name STRING data type GET/SET
      dc09: Date Modified STRING data type DATETIME FORM READ ONLY
      dc0b: Parent Object UINT32 data type ANY 32BIT VALUE form READ ONLY
      dc41: Persistant Unique Object Identifier UINT128 data type READ ONLY
      dc44: Name STRING data type READ ONLY
      dce0: Display Name STRING data type READ ONLY
      dc4e: Date Added STRING data type DATETIME FORM READ ONLY
   3804: BMP
      dc01: Storage ID UINT32 data type ANY 32BIT VALUE form READ ONLY
      dc02: Object Format UINT16 data type ANY 16BIT VALUE form READ ONLY
      dc03: Protection Status UINT16 data type ANY 16BIT VALUE form READ ONLY
      dc04: Object Size UINT64 data type READ ONLY
      dc07: Object File Name STRING data type GET/SET
      dc09: Date Modified STRING data type DATETIME FORM READ ONLY
      dc0b: Parent Object UINT32 data type ANY 32BIT VALUE form READ ONLY
      dc41: Persistant Unique Object Identifier UINT128 data type READ ONLY
      dc44: Name STRING data type READ ONLY
      dce0: Display Name STRING data type READ ONLY
      dc4e: Date Added STRING data type DATETIME FORM READ ONLY
      dc48: Description STRING data type READ ONLY
   3807: GIF
      dc01: Storage ID UINT32 data type ANY 32BIT VALUE form READ ONLY
      dc02: Object Format UINT16 data type ANY 16BIT VALUE form READ ONLY
      dc03: Protection Status UINT16 data type ANY 16BIT VALUE form READ ONLY
      dc04: Object Size UINT64 data type READ ONLY
      dc07: Object File Name STRING data type GET/SET
      dc09: Date Modified STRING data type DATETIME FORM READ ONLY
      dc0b: Parent Object UINT32 data type ANY 32BIT VALUE form READ ONLY
      dc41: Persistant Unique Object Identifier UINT128 data type READ ONLY
      dc44: Name STRING data type READ ONLY
      dce0: Display Name STRING data type READ ONLY
      dc4e: Date Added STRING data type DATETIME FORM READ ONLY
      dc48: Description STRING data type READ ONLY
   3808: JFIF
      dc01: Storage ID UINT32 data type ANY 32BIT VALUE form READ ONLY
      dc02: Object Format UINT16 data type ANY 16BIT VALUE form READ ONLY
      dc03: Protection Status UINT16 data type ANY 16BIT VALUE form READ ONLY
      dc04: Object Size UINT64 data type READ ONLY
      dc07: Object File Name STRING data type GET/SET
      dc09: Date Modified STRING data type DATETIME FORM READ ONLY
      dc0b: Parent Object UINT32 data type ANY 32BIT VALUE form READ ONLY
      dc41: Persistant Unique Object Identifier UINT128 data type READ ONLY
      dc44: Name STRING data type READ ONLY
      dce0: Display Name STRING data type READ ONLY
      dc4e: Date Added STRING data type DATETIME FORM READ ONLY
   380b: PNG
      dc01: Storage ID UINT32 data type ANY 32BIT VALUE form READ ONLY
      dc02: Object Format UINT16 data type ANY 16BIT VALUE form READ ONLY
      dc03: Protection Status UINT16 data type ANY 16BIT VALUE form READ ONLY
      dc04: Object Size UINT64 data type READ ONLY
      dc07: Object File Name STRING data type GET/SET
      dc09: Date Modified STRING data type DATETIME FORM READ ONLY
      dc0b: Parent Object UINT32 data type ANY 32BIT VALUE form READ ONLY
      dc41: Persistant Unique Object Identifier UINT128 data type READ ONLY
      dc44: Name STRING data type READ ONLY
      dce0: Display Name STRING data type READ ONLY
      dc4e: Date Added STRING data type DATETIME FORM READ ONLY
      dc48: Description STRING data type READ ONLY
   380d: TIFF
      dc01: Storage ID UINT32 data type ANY 32BIT VALUE form READ ONLY
      dc02: Object Format UINT16 data type ANY 16BIT VALUE form READ ONLY
      dc03: Protection Status UINT16 data type ANY 16BIT VALUE form READ ONLY
      dc04: Object Size UINT64 data type READ ONLY
      dc07: Object File Name STRING data type GET/SET
      dc09: Date Modified STRING data type DATETIME FORM READ ONLY
      dc0b: Parent Object UINT32 data type ANY 32BIT VALUE form READ ONLY
      dc41: Persistant Unique Object Identifier UINT128 data type READ ONLY
      dc44: Name STRING data type READ ONLY
      dce0: Display Name STRING data type READ ONLY
      dc4e: Date Added STRING data type DATETIME FORM READ ONLY
   b901: WMA
      dc01: Storage ID UINT32 data type ANY 32BIT VALUE form READ ONLY
      dc02: Object Format UINT16 data type ANY 16BIT VALUE form READ ONLY
      dc03: Protection Status UINT16 data type ANY 16BIT VALUE form READ ONLY
      dc04: Object Size UINT64 data type READ ONLY
      dc07: Object File Name STRING data type GET/SET
      dc09: Date Modified STRING data type DATETIME FORM READ ONLY
      dc0b: Parent Object UINT32 data type ANY 32BIT VALUE form READ ONLY
      dc41: Persistant Unique Object Identifier UINT128 data type READ ONLY
      dc44: Name STRING data type READ ONLY
      dce0: Display Name STRING data type READ ONLY
      dc4e: Date Added STRING data type DATETIME FORM READ ONLY
      dc46: Artist STRING data type READ ONLY
      dc9a: Album Name STRING data type READ ONLY
      dc9b: Album Artist STRING data type READ ONLY
      dc8b: Track UINT16 data type ANY 16BIT VALUE form READ ONLY
      dc99: Original Release Date STRING data type DATETIME FORM READ ONLY
      dc89: Duration UINT32 data type ANY 32BIT VALUE form READ ONLY
      dc8c: Genre STRING data type READ ONLY
      dc96: Composer STRING data type READ ONLY
      de99: Audio WAVE Codec UINT32 data type ANY 32BIT VALUE form READ ONLY
      de92: Bit Rate Type UINT16 data type enumeration: 1, 2,  READ ONLY
      de9a: Audio Bit Rate UINT32 data type range: MIN 1, MAX 1536000, STEP 1 READ ONLY
      de94: Number Of Channels UINT16 data type enumeration: 1, 2, 3, 4, 5, 6, 7, 8, 9,  READ ONLY
      de93: Sample Rate UINT32 data type range: MIN 8000, MAX 48000, STEP 1 READ ONLY
   b902: OGG
      dc01: Storage ID UINT32 data type ANY 32BIT VALUE form READ ONLY
      dc02: Object Format UINT16 data type ANY 16BIT VALUE form READ ONLY
      dc03: Protection Status UINT16 data type ANY 16BIT VALUE form READ ONLY
      dc04: Object Size UINT64 data type READ ONLY
      dc07: Object File Name STRING data type GET/SET
      dc09: Date Modified STRING data type DATETIME FORM READ ONLY
      dc0b: Parent Object UINT32 data type ANY 32BIT VALUE form READ ONLY
      dc41: Persistant Unique Object Identifier UINT128 data type READ ONLY
      dc44: Name STRING data type READ ONLY
      dce0: Display Name STRING data type READ ONLY
      dc4e: Date Added STRING data type DATETIME FORM READ ONLY
      dc46: Artist STRING data type READ ONLY
      dc9a: Album Name STRING data type READ ONLY
      dc9b: Album Artist STRING data type READ ONLY
      dc8b: Track UINT16 data type ANY 16BIT VALUE form READ ONLY
      dc99: Original Release Date STRING data type DATETIME FORM READ ONLY
      dc89: Duration UINT32 data type ANY 32BIT VALUE form READ ONLY
      dc8c: Genre STRING data type READ ONLY
      dc96: Composer STRING data type READ ONLY
      de99: Audio WAVE Codec UINT32 data type ANY 32BIT VALUE form READ ONLY
      de92: Bit Rate Type UINT16 data type enumeration: 1, 2,  READ ONLY
      de9a: Audio Bit Rate UINT32 data type range: MIN 1, MAX 1536000, STEP 1 READ ONLY
      de94: Number Of Channels UINT16 data type enumeration: 1, 2, 3, 4, 5, 6, 7, 8, 9,  READ ONLY
      de93: Sample Rate UINT32 data type range: MIN 8000, MAX 48000, STEP 1 READ ONLY
   b903: AAC
      dc01: Storage ID UINT32 data type ANY 32BIT VALUE form READ ONLY
      dc02: Object Format UINT16 data type ANY 16BIT VALUE form READ ONLY
      dc03: Protection Status UINT16 data type ANY 16BIT VALUE form READ ONLY
      dc04: Object Size UINT64 data type READ ONLY
      dc07: Object File Name STRING data type GET/SET
      dc09: Date Modified STRING data type DATETIME FORM READ ONLY
      dc0b: Parent Object UINT32 data type ANY 32BIT VALUE form READ ONLY
      dc41: Persistant Unique Object Identifier UINT128 data type READ ONLY
      dc44: Name STRING data type READ ONLY
      dce0: Display Name STRING data type READ ONLY
      dc4e: Date Added STRING data type DATETIME FORM READ ONLY
      dc46: Artist STRING data type READ ONLY
      dc9a: Album Name STRING data type READ ONLY
      dc9b: Album Artist STRING data type READ ONLY
      dc8b: Track UINT16 data type ANY 16BIT VALUE form READ ONLY
      dc99: Original Release Date STRING data type DATETIME FORM READ ONLY
      dc89: Duration UINT32 data type ANY 32BIT VALUE form READ ONLY
      dc8c: Genre STRING data type READ ONLY
      dc96: Composer STRING data type READ ONLY
      de99: Audio WAVE Codec UINT32 data type ANY 32BIT VALUE form READ ONLY
      de92: Bit Rate Type UINT16 data type enumeration: 1, 2,  READ ONLY
      de9a: Audio Bit Rate UINT32 data type range: MIN 1, MAX 1536000, STEP 1 READ ONLY
      de94: Number Of Channels UINT16 data type enumeration: 1, 2, 3, 4, 5, 6, 7, 8, 9,  READ ONLY
      de93: Sample Rate UINT32 data type range: MIN 8000, MAX 48000, STEP 1 READ ONLY
   b982: MP4
      dc01: Storage ID UINT32 data type ANY 32BIT VALUE form READ ONLY
      dc02: Object Format UINT16 data type ANY 16BIT VALUE form READ ONLY
      dc03: Protection Status UINT16 data type ANY 16BIT VALUE form READ ONLY
      dc04: Object Size UINT64 data type READ ONLY
      dc07: Object File Name STRING data type GET/SET
      dc09: Date Modified STRING data type DATETIME FORM READ ONLY
      dc0b: Parent Object UINT32 data type ANY 32BIT VALUE form READ ONLY
      dc41: Persistant Unique Object Identifier UINT128 data type READ ONLY
      dc44: Name STRING data type READ ONLY
      dce0: Display Name STRING data type READ ONLY
      dc4e: Date Added STRING data type DATETIME FORM READ ONLY
   b983: MP2
      dc01: Storage ID UINT32 data type ANY 32BIT VALUE form READ ONLY
      dc02: Object Format UINT16 data type ANY 16BIT VALUE form READ ONLY
      dc03: Protection Status UINT16 data type ANY 16BIT VALUE form READ ONLY
      dc04: Object Size UINT64 data type READ ONLY
      dc07: Object File Name STRING data type GET/SET
      dc09: Date Modified STRING data type DATETIME FORM READ ONLY
      dc0b: Parent Object UINT32 data type ANY 32BIT VALUE form READ ONLY
      dc41: Persistant Unique Object Identifier UINT128 data type READ ONLY
      dc44: Name STRING data type READ ONLY
      dce0: Display Name STRING data type READ ONLY
      dc4e: Date Added STRING data type DATETIME FORM READ ONLY
   b984: 3GP
      dc01: Storage ID UINT32 data type ANY 32BIT VALUE form READ ONLY
      dc02: Object Format UINT16 data type ANY 16BIT VALUE form READ ONLY
      dc03: Protection Status UINT16 data type ANY 16BIT VALUE form READ ONLY
      dc04: Object Size UINT64 data type READ ONLY
      dc07: Object File Name STRING data type GET/SET
      dc09: Date Modified STRING data type DATETIME FORM READ ONLY
      dc0b: Parent Object UINT32 data type ANY 32BIT VALUE form READ ONLY
      dc41: Persistant Unique Object Identifier UINT128 data type READ ONLY
      dc44: Name STRING data type READ ONLY
      dce0: Display Name STRING data type READ ONLY
      dc4e: Date Added STRING data type DATETIME FORM READ ONLY
      dc46: Artist STRING data type READ ONLY
      dc9a: Album Name STRING data type READ ONLY
      dc89: Duration UINT32 data type ANY 32BIT VALUE form READ ONLY
      dc48: Description STRING data type READ ONLY
   ba05: Abstract Audio Video Playlist
      dc01: Storage ID UINT32 data type ANY 32BIT VALUE form READ ONLY
      dc02: Object Format UINT16 data type ANY 16BIT VALUE form READ ONLY
      dc03: Protection Status UINT16 data type ANY 16BIT VALUE form READ ONLY
      dc04: Object Size UINT64 data type READ ONLY
      dc07: Object File Name STRING data type GET/SET
      dc09: Date Modified STRING data type DATETIME FORM READ ONLY
      dc0b: Parent Object UINT32 data type ANY 32BIT VALUE form READ ONLY
      dc41: Persistant Unique Object Identifier UINT128 data type READ ONLY
      dc44: Name STRING data type READ ONLY
      dce0: Display Name STRING data type READ ONLY
      dc4e: Date Added STRING data type DATETIME FORM READ ONLY
   ba10: WPL Playlist
      dc01: Storage ID UINT32 data type ANY 32BIT VALUE form READ ONLY
      dc02: Object Format UINT16 data type ANY 16BIT VALUE form READ ONLY
      dc03: Protection Status UINT16 data type ANY 16BIT VALUE form READ ONLY
      dc04: Object Size UINT64 data type READ ONLY
      dc07: Object File Name STRING data type GET/SET
      dc09: Date Modified STRING data type DATETIME FORM READ ONLY
      dc0b: Parent Object UINT32 data type ANY 32BIT VALUE form READ ONLY
      dc41: Persistant Unique Object Identifier UINT128 data type READ ONLY
      dc44: Name STRING data type READ ONLY
      dce0: Display Name STRING data type READ ONLY
      dc4e: Date Added STRING data type DATETIME FORM READ ONLY
   ba11: M3U Playlist
      dc01: Storage ID UINT32 data type ANY 32BIT VALUE form READ ONLY
      dc02: Object Format UINT16 data type ANY 16BIT VALUE form READ ONLY
      dc03: Protection Status UINT16 data type ANY 16BIT VALUE form READ ONLY
      dc04: Object Size UINT64 data type READ ONLY
      dc07: Object File Name STRING data type GET/SET
      dc09: Date Modified STRING data type DATETIME FORM READ ONLY
      dc0b: Parent Object UINT32 data type ANY 32BIT VALUE form READ ONLY
      dc41: Persistant Unique Object Identifier UINT128 data type READ ONLY
      dc44: Name STRING data type READ ONLY
      dce0: Display Name STRING data type READ ONLY
      dc4e: Date Added STRING data type DATETIME FORM READ ONLY
   ba14: PLS Playlist
      dc01: Storage ID UINT32 data type ANY 32BIT VALUE form READ ONLY
      dc02: Object Format UINT16 data type ANY 16BIT VALUE form READ ONLY
      dc03: Protection Status UINT16 data type ANY 16BIT VALUE form READ ONLY
      dc04: Object Size UINT64 data type READ ONLY
      dc07: Object File Name STRING data type GET/SET
      dc09: Date Modified STRING data type DATETIME FORM READ ONLY
      dc0b: Parent Object UINT32 data type ANY 32BIT VALUE form READ ONLY
      dc41: Persistant Unique Object Identifier UINT128 data type READ ONLY
      dc44: Name STRING data type READ ONLY
      dce0: Display Name STRING data type READ ONLY
      dc4e: Date Added STRING data type DATETIME FORM READ ONLY
   ba82: XMLDocument
      dc01: Storage ID UINT32 data type ANY 32BIT VALUE form READ ONLY
      dc02: Object Format UINT16 data type ANY 16BIT VALUE form READ ONLY
      dc03: Protection Status UINT16 data type ANY 16BIT VALUE form READ ONLY
      dc04: Object Size UINT64 data type READ ONLY
      dc07: Object File Name STRING data type GET/SET
      dc09: Date Modified STRING data type DATETIME FORM READ ONLY
      dc0b: Parent Object UINT32 data type ANY 32BIT VALUE form READ ONLY
      dc41: Persistant Unique Object Identifier UINT128 data type READ ONLY
      dc44: Name STRING data type READ ONLY
      dce0: Display Name STRING data type READ ONLY
      dc4e: Date Added STRING data type DATETIME FORM READ ONLY
   b906: FLAC
      dc01: Storage ID UINT32 data type ANY 32BIT VALUE form READ ONLY
      dc02: Object Format UINT16 data type ANY 16BIT VALUE form READ ONLY
      dc03: Protection Status UINT16 data type ANY 16BIT VALUE form READ ONLY
      dc04: Object Size UINT64 data type READ ONLY
      dc07: Object File Name STRING data type GET/SET
      dc09: Date Modified STRING data type DATETIME FORM READ ONLY
      dc0b: Parent Object UINT32 data type ANY 32BIT VALUE form READ ONLY
      dc41: Persistant Unique Object Identifier UINT128 data type READ ONLY
      dc44: Name STRING data type READ ONLY
      dce0: Display Name STRING data type READ ONLY
      dc4e: Date Added STRING data type DATETIME FORM READ ONLY
Storage Devices:
   StorageID: 0x00010001
      StorageType: 0x0003 fixed RAM storage
      FilesystemType: 0x0002 generic hierarchical
      AccessCapability: 0x0000 read/write
      MaxCapacity: 10489024512
      FreeSpaceInBytes: 6714171392
      FreeSpaceInObjects: 1073741824
      StorageDescription: Pamięć telefonu
      VolumeIdentifier: (null)
Special directories:
   Default music folder: 0xffffffff
   Default playlist folder: 0xffffffff
   Default picture folder: 0xffffffff
   Default video folder: 0xffffffff
   Default organizer folder: 0xffffffff
   Default zencast folder: 0xffffffff
   Default album folder: 0xffffffff
   Default text folder: 0xffffffff
MTP-specific device properties:
   Friendly name: Neffos C5 Max
   Synchronization partner: Neffos C5 Max
   Battery level 99 of 100 (99%)
libmtp supported (playable) filetypes:
   Folder
   Text file
   HTML file
   RIFF WAVE file
   ISO MPEG-1 Audio Layer 3
   MPEG video stream
   JPEG file
   BMP bitmap file
   GIF bitmap file
   JFIF file
   Portable Network Graphics
   TIFF bitmap file
   Microsoft Windows Media Audio
   Ogg container format
   Advanced Audio Coding (AAC)/MPEG-2 Part 7/MPEG-4 Part 3
   MPEG-4 Part 14 Container Format (Audio+Video Emphasis)
   ISO MPEG-1 Audio Layer 2
   Abstract Playlist file
   XML file
   Free Lossless Audio Codec (FLAC)
~~~



---

Sent from sourceforge.net because you indicated interest in <https://sourceforge.net/p/libmtp/feature-requests/197/>



To unsubscribe from further messages, please visit <https://sourceforge.net/auth/subscriptions/>